{
  "schema_version": "stage-result.v1",
  "run_id": "standalone-stage-run-1b77e0c4a2194f0e8d3a6c15b7290ef8",
  "stage_run_id": "stage-run-1b77e0c4a2194f0e8d3a6c15b7290ef8",
  "workflow_id": null,
  "workflow_run_id": null,
  "dataset_id": null,
  "attempt": 2,
  "stage": "denoise",
  "task": "denoise",
  "backend": "dada2-r",
  "status": "timed_out",
  "exit_code": null,
  "error": {"type": "TimeoutExpired", "message": "Command timed out after 60 seconds"},
  "timing": {
    "started_at": "2026-07-14T10:00:00Z",
    "finished_at": "2026-07-14T10:01:00Z",
    "duration_sec": 60.0
  },
  "command": ["Rscript", "denoise.R"],
  "subprocesses": [
    {"command": ["Rscript", "denoise.R"], "status": "timed_out", "exit_code": null, "duration_sec": 60.0, "required": true}
  ],
  "params": {"trunc_len_f": 240},
  "inputs": [],
  "outputs": [
    {"label": "feature table", "path": "feature-table.tsv", "required": true, "external": false, "exists": false}
  ],
  "provenance_files": [],
  "metrics": {},
  "software": {},
  "reference_db": null,
  "producer": {"name": "microsuite", "version": "0.1.0"}
}
